{
  "schema_version": "dna.analysis/v10",
  "provenance": {
    "input": {
      "sha256": "aaaaaaaaaaaaaaaaaaaaaaaaaaaaaaaaaaaaaaaaaaaaaaaaaaaaaaaaaaaaaaaa"
    },
    "reference": {
      "name": "synthetic-reference",
      "topology": "linear",
      "sha256": "bbbbbbbbbbbbbbbbbbbbbbbbbbbbbbbbbbbbbbbbbbbbbbbbbbbbbbbbbbbbbbbb"
    },
    "configuration_sha256": "cccccccccccccccccccccccccccccccccccccccccccccccccccccccccccccccc",
    "profile": {
      "id": "human-mtdna-rcrs",
      "sha256": "55e4ea8efb2c719e9a2a356d6adf87d21f5892a931279d5da5ba42ffd4b2ce39"
    },
    "plugins": [
      {
        "id": "sanger",
        "family": "modality",
        "version": 3
      },
      {
        "id": "core",
        "family": "core",
        "version": 8
      }
    ]
  },
  "read": {
    "call_count": 28,
    "trim": {
      "start": 2,
      "end": 26
    },
    "callability": {
      "callable_span": {
        "start": 2,
        "end": 26
      },
      "segments": [
        {
          "calls": {
            "start": 0,
            "end": 2
          },
          "state": "weak",
          "after_repeat": false
        },
        {
          "calls": {
            "start": 2,
            "end": 26
          },
          "state": "in_phase",
          "after_repeat": false
        },
        {
          "calls": {
            "start": 26,
            "end": 28
          },
          "state": "dephased",
          "after_repeat": true,
          "shadow_offsets": [
            -1,
            1
          ]
        }
      ],
      "masked_calls": 4
    }
  },
  "signal_quality": {
    "integrity": {
      "ploc_count": 28,
      "duplicate_ploc_positions": 0,
      "vendor_primary_count": 28,
      "vendor_quality_count": 28,
      "minimum_ploc_spacing": 4,
      "median_ploc_spacing": 4,
      "maximum_ploc_spacing": 4,
      "clipped_channel_samples": 0,
      "maximum_to_median_event_signal_ratio": 1
    },
    "noisy_regions": [
      {
        "calls": {
          "start": 8,
          "end": 15
        },
        "samples": {
          "start": 79,
          "end": 151
        },
        "minimum_primary_snr": 4.125
      }
    ]
  },
  "alignment": {
    "orientation": "forward",
    "callable_bases": 24,
    "identity": 0.9583333333333334,
    "unresolved_bases": 0,
    "masked_bases": 0,
    "gap_opens": 0,
    "reference_segments": [
      {
        "start": 100,
        "end": 124
      }
    ],
    "callable_reference_segments": [
      {
        "start": 100,
        "end": 124
      }
    ],
    "wraps_origin": false
  },
  "calls": [
    {
      "index": 2,
      "column": {
        "position": 101,
        "ordinal": 0
      },
      "trust": {
        "placement": {
          "kind": "scored"
        },
        "trusted": false,
        "exempt": false,
        "withheld_by": [
          {
            "kind": "untrimmed"
          }
        ],
        "scope": "full"
      }
    },
    {
      "index": 3,
      "column": {
        "position": 102,
        "ordinal": 0
      },
      "trust": {
        "placement": {
          "kind": "scored"
        },
        "trusted": false,
        "exempt": false,
        "withheld_by": [
          {
            "kind": "untrimmed"
          }
        ],
        "scope": "full"
      }
    },
    {
      "index": 4,
      "column": {
        "position": 103,
        "ordinal": 0
      },
      "trust": {
        "placement": {
          "kind": "scored"
        },
        "trusted": true,
        "exempt": false,
        "withheld_by": [],
        "scope": "full"
      }
    },
    {
      "index": 5,
      "column": {
        "position": 104,
        "ordinal": 0
      },
      "trust": {
        "placement": {
          "kind": "scored"
        },
        "trusted": true,
        "exempt": false,
        "withheld_by": [],
        "scope": "full"
      }
    },
    {
      "index": 6,
      "column": {
        "position": 105,
        "ordinal": 0
      },
      "trust": {
        "placement": {
          "kind": "scored"
        },
        "trusted": true,
        "exempt": false,
        "withheld_by": [],
        "scope": "full"
      }
    },
    {
      "index": 7,
      "column": {
        "position": 106,
        "ordinal": 0
      },
      "trust": {
        "placement": {
          "kind": "scored"
        },
        "trusted": true,
        "exempt": false,
        "withheld_by": [],
        "scope": "full"
      }
    },
    {
      "index": 8,
      "column": {
        "position": 107,
        "ordinal": 0
      },
      "trust": {
        "placement": {
          "kind": "scored"
        },
        "trusted": true,
        "exempt": false,
        "withheld_by": [],
        "scope": "full"
      }
    },
    {
      "index": 9,
      "column": {
        "position": 108,
        "ordinal": 0
      },
      "trust": {
        "placement": {
          "kind": "scored"
        },
        "trusted": true,
        "exempt": false,
        "withheld_by": [],
        "scope": "full"
      }
    },
    {
      "index": 10,
      "column": {
        "position": 109,
        "ordinal": 0
      },
      "trust": {
        "placement": {
          "kind": "scored"
        },
        "trusted": true,
        "exempt": false,
        "withheld_by": [],
        "scope": "full"
      }
    },
    {
      "index": 11,
      "column": {
        "position": 110,
        "ordinal": 0
      },
      "trust": {
        "placement": {
          "kind": "scored"
        },
        "trusted": true,
        "exempt": false,
        "withheld_by": [],
        "scope": "full"
      }
    },
    {
      "index": 12,
      "column": {
        "position": 111,
        "ordinal": 0
      },
      "trust": {
        "placement": {
          "kind": "scored"
        },
        "trusted": true,
        "exempt": false,
        "withheld_by": [],
        "scope": "full"
      }
    },
    {
      "index": 13,
      "column": {
        "position": 112,
        "ordinal": 0
      },
      "trust": {
        "placement": {
          "kind": "scored"
        },
        "trusted": true,
        "exempt": false,
        "withheld_by": [],
        "scope": "full"
      }
    },
    {
      "index": 14,
      "column": {
        "position": 113,
        "ordinal": 0
      },
      "trust": {
        "placement": {
          "kind": "scored"
        },
        "trusted": true,
        "exempt": false,
        "withheld_by": [],
        "scope": "full"
      }
    },
    {
      "index": 15,
      "column": {
        "position": 114,
        "ordinal": 0
      },
      "trust": {
        "placement": {
          "kind": "scored"
        },
        "trusted": true,
        "exempt": false,
        "withheld_by": [],
        "scope": "full"
      }
    },
    {
      "index": 16,
      "column": {
        "position": 115,
        "ordinal": 0
      },
      "trust": {
        "placement": {
          "kind": "scored"
        },
        "trusted": true,
        "exempt": false,
        "withheld_by": [],
        "scope": "full"
      }
    },
    {
      "index": 17,
      "column": {
        "position": 116,
        "ordinal": 0
      },
      "trust": {
        "placement": {
          "kind": "scored"
        },
        "trusted": true,
        "exempt": false,
        "withheld_by": [],
        "scope": "full"
      }
    },
    {
      "index": 18,
      "column": {
        "position": 117,
        "ordinal": 0
      },
      "trust": {
        "placement": {
          "kind": "scored"
        },
        "trusted": true,
        "exempt": false,
        "withheld_by": [],
        "scope": "full"
      }
    },
    {
      "index": 19,
      "column": {
        "position": 118,
        "ordinal": 0
      },
      "trust": {
        "placement": {
          "kind": "scored"
        },
        "trusted": true,
        "exempt": false,
        "withheld_by": [],
        "scope": "full"
      }
    },
    {
      "index": 20,
      "column": {
        "position": 119,
        "ordinal": 0
      },
      "trust": {
        "placement": {
          "kind": "scored"
        },
        "trusted": true,
        "exempt": false,
        "withheld_by": [],
        "scope": "full"
      }
    },
    {
      "index": 21,
      "column": {
        "position": 120,
        "ordinal": 0
      },
      "trust": {
        "placement": {
          "kind": "scored"
        },
        "trusted": true,
        "exempt": false,
        "withheld_by": [],
        "scope": "full"
      }
    },
    {
      "index": 22,
      "column": {
        "position": 121,
        "ordinal": 0
      },
      "trust": {
        "placement": {
          "kind": "scored"
        },
        "trusted": true,
        "exempt": false,
        "withheld_by": [],
        "scope": "full"
      }
    },
    {
      "index": 23,
      "column": {
        "position": 122,
        "ordinal": 0
      },
      "trust": {
        "placement": {
          "kind": "scored"
        },
        "trusted": true,
        "exempt": false,
        "withheld_by": [],
        "scope": "full"
      }
    },
    {
      "index": 24,
      "column": {
        "position": 123,
        "ordinal": 0
      },
      "trust": {
        "placement": {
          "kind": "scored"
        },
        "trusted": false,
        "exempt": false,
        "withheld_by": [
          {
            "kind": "untrimmed"
          }
        ],
        "scope": "full"
      }
    },
    {
      "index": 25,
      "column": {
        "position": 124,
        "ordinal": 0
      },
      "trust": {
        "placement": {
          "kind": "scored"
        },
        "trusted": false,
        "exempt": false,
        "withheld_by": [
          {
            "kind": "untrimmed"
          }
        ],
        "scope": "full"
      }
    }
  ],
  "variants": [
    {
      "position": 112,
      "reference": "A",
      "alternate": "G",
      "kind": "SNV",
      "calls": [